{
  "iteration": 1,
  "run_id": "2026-09-06T14-40-19Z-smoke",
  "commit": "6108d39",
  "tier": "smoke",
  "verdict": "FAIL",
  "primary_fault": "buffers",
  "window_actual_s": 186.52,
  "content_fps": 60.0,
  "bucket_s": 60.0,
  "buckets": [
    {
      "index": 0,
      "t_start_s": 0.0,
      "span_s": 60.0,
      "complete": true,
      "frame_interval_ms": 16.667,
      "av_offset_mean_ms": -1213.9,
      "av_offset_p95_ms": 1346.47,
      "av_offset_min_ms": -1396.17,
      "av_offset_max_ms": -1029.34,
      "av_envelope_violations": 3584,
      "av_envelope_violation_pct": 100.0,
      "av_samples": 3584,
      "present_delay_mean_ms": 4855.61,
      "present_delay_p95_ms": 4988.13,
      "present_delay_samples": 3584,
      "frames_presented": 3584,
      "frames_expected": 3600,
      "frames_dropped": 0,
      "frames_repeated": 0,
      "frame_interval_p95_err_ms": 0.18,
      "audio_periods_written": 12007,
      "audio_periods_expected": 2584,
      "audio_pad_samples": 495386,
      "audio_fifo_level_min_pct": 0.0,
      "audio_fifo_underflows": 2098,
      "audio_fifo_overflows": 0,
      "jitter_buffer_underflows": 0,
      "jitter_buffer_overflows": 0,
      "drm_pool_exhausted": 0,
      "seg_queue_starved": 0,
      "seg_fetch_ok": 100,
      "seg_fetch_fail": 0,
      "seg_fetch_miss": 0,
      "seg_fetch_p95_ms": 221.5,
      "seg_fetch_max_ms": 255.13,
      "tcp_rtt_p95_ms": 12.33,
      "mpd_reload_fail": 0,
      "resyncs": 0,
      "vsync_miss": 3584,
      "vsync_dup": 0,
      "flip_error": 0,
      "flip_timeout": 0,
      "drm_event_starve": 0,
      "async_cuda": 0,
      "async_copy": 0,
      "async_stage": 0,
      "clock_fallback": 0,
      "decode_errors": 0,
      "decoder_unavailable": 0,
      "decoder_reinit": 0,
      "corrupt_frames": 0,
      "missing_ref": 0,
      "decode_p95_ms": 1.62,
      "verdict": "FAIL",
      "failed_gates": [
        {
          "gate": "audio_fifo_underflows",
          "value": 2098,
          "limit": 0,
          "class": "buffers",
          "bucket": 0
        },
        {
          "gate": "audio_pad_samples",
          "value": 495386,
          "limit": 0,
          "class": "buffers",
          "bucket": 0
        },
        {
          "gate": "vsync_miss",
          "value": 3584,
          "limit": 0,
          "class": "vsync_async",
          "bucket": 0
        },
        {
          "gate": "audio_period_deviation",
          "value": 3.6467,
          "limit": 0.005,
          "class": "cadence",
          "bucket": 0
        },
        {
          "gate": "audio_fifo_level_min_pct",
          "value": 0.0,
          "limit": 15.0,
          "class": "buffers",
          "bucket": 0
        },
        {
          "gate": "av_offset_mean_ms",
          "value": -1213.9,
          "limit": 10.0,
          "class": "av_sync",
          "bucket": 0
        },
        {
          "gate": "av_offset_p95_ms",
          "value": 1346.47,
          "limit": 20.0,
          "class": "av_sync",
          "bucket": 0
        },
        {
          "gate": "av_envelope_violation_pct",
          "value": 100.0,
          "limit": 0.1,
          "class": "av_sync",
          "bucket": 0
        }
      ]
    },
    {
      "index": 1,
      "t_start_s": 60.0,
      "span_s": 60.0,
      "complete": true,
      "frame_interval_ms": 16.667,
      "av_offset_mean_ms": -1488.33,
      "av_offset_p95_ms": 1629.6,
      "av_offset_min_ms": -1671.66,
      "av_offset_max_ms": -1312.79,
      "av_envelope_violations": 3583,
      "av_envelope_violation_pct": 100.0,
      "av_samples": 3583,
      "present_delay_mean_ms": 5129.94,
      "present_delay_p95_ms": 5265.42,
      "present_delay_samples": 3583,
      "frames_presented": 3583,
      "frames_expected": 3600,
      "frames_dropped": 0,
      "frames_repeated": 0,
      "frame_interval_p95_err_ms": 0.18,
      "audio_periods_written": 12000,
      "audio_periods_expected": 2584,
      "audio_pad_samples": 498581,
      "audio_fifo_level_min_pct": 0.0,
      "audio_fifo_underflows": 2112,
      "audio_fifo_overflows": 0,
      "jitter_buffer_underflows": 0,
      "jitter_buffer_overflows": 0,
      "drm_pool_exhausted": 0,
      "seg_queue_starved": 0,
      "seg_fetch_ok": 100,
      "seg_fetch_fail": 0,
      "seg_fetch_miss": 0,
      "seg_fetch_p95_ms": 201.42,
      "seg_fetch_max_ms": 223.66,
      "tcp_rtt_p95_ms": 12.95,
      "mpd_reload_fail": 0,
      "resyncs": 0,
      "vsync_miss": 3583,
      "vsync_dup": 0,
      "flip_error": 0,
      "flip_timeout": 0,
      "drm_event_starve": 0,
      "async_cuda": 0,
      "async_copy": 0,
      "async_stage": 0,
      "clock_fallback": 0,
      "decode_errors": 0,
      "decoder_unavailable": 0,
      "decoder_reinit": 0,
      "corrupt_frames": 0,
      "missing_ref": 0,
      "decode_p95_ms": 0.11,
      "verdict": "FAIL",
      "failed_gates": [
        {
          "gate": "audio_fifo_underflows",
          "value": 2112,
          "limit": 0,
          "class": "buffers",
          "bucket": 1
        },
        {
          "gate": "audio_pad_samples",
          "value": 498581,
          "limit": 0,
          "class": "buffers",
          "bucket": 1
        },
        {
          "gate": "vsync_miss",
          "value": 3583,
          "limit": 0,
          "class": "vsync_async",
          "bucket": 1
        },
        {
          "gate": "audio_period_deviation",
          "value": 3.644,
          "limit": 0.005,
          "class": "cadence",
          "bucket": 1
        },
        {
          "gate": "audio_fifo_level_min_pct",
          "value": 0.0,
          "limit": 15.0,
          "class": "buffers",
          "bucket": 1
        },
        {
          "gate": "av_offset_mean_ms",
          "value": -1488.33,
          "limit": 10.0,
          "class": "av_sync",
          "bucket": 1
        },
        {
          "gate": "av_offset_p95_ms",
          "value": 1629.6,
          "limit": 20.0,
          "class": "av_sync",
          "bucket": 1
        },
        {
          "gate": "av_envelope_violation_pct",
          "value": 100.0,
          "limit": 0.1,
          "class": "av_sync",
          "bucket": 1
        }
      ]
    },
    {
      "index": 2,
      "t_start_s": 120.0,
      "span_s": 60.0,
      "complete": true,
      "frame_interval_ms": 16.667,
      "av_offset_mean_ms": -1767.52,
      "av_offset_p95_ms": 1913.16,
      "av_offset_min_ms": -1947.06,
      "av_offset_max_ms": -1596.25,
      "av_envelope_violations": 3583,
      "av_envelope_violation_pct": 100.0,
      "av_samples": 3583,
      "present_delay_mean_ms": 5409.08,
      "present_delay_p95_ms": 5542.6,
      "present_delay_samples": 3583,
      "frames_presented": 3583,
      "frames_expected": 3600,
      "frames_dropped": 0,
      "frames_repeated": 0,
      "frame_interval_p95_err_ms": 0.16,
      "audio_periods_written": 12000,
      "audio_periods_expected": 2584,
      "audio_pad_samples": 493541,
      "audio_fifo_level_min_pct": 0.0,
      "audio_fifo_underflows": 2092,
      "audio_fifo_overflows": 0,
      "jitter_buffer_underflows": 0,
      "jitter_buffer_overflows": 0,
      "drm_pool_exhausted": 0,
      "seg_queue_starved": 0,
      "seg_fetch_ok": 100,
      "seg_fetch_fail": 0,
      "seg_fetch_miss": 0,
      "seg_fetch_p95_ms": 231.76,
      "seg_fetch_max_ms": 286.85,
      "tcp_rtt_p95_ms": 12.39,
      "mpd_reload_fail": 0,
      "resyncs": 0,
      "vsync_miss": 3583,
      "vsync_dup": 0,
      "flip_error": 0,
      "flip_timeout": 0,
      "drm_event_starve": 0,
      "async_cuda": 0,
      "async_copy": 0,
      "async_stage": 0,
      "clock_fallback": 0,
      "decode_errors": 0,
      "decoder_unavailable": 0,
      "decoder_reinit": 0,
      "corrupt_frames": 0,
      "missing_ref": 0,
      "decode_p95_ms": 0.12,
      "verdict": "FAIL",
      "failed_gates": [
        {
          "gate": "audio_fifo_underflows",
          "value": 2092,
          "limit": 0,
          "class": "buffers",
          "bucket": 2
        },
        {
          "gate": "audio_pad_samples",
          "value": 493541,
          "limit": 0,
          "class": "buffers",
          "bucket": 2
        },
        {
          "gate": "vsync_miss",
          "value": 3583,
          "limit": 0,
          "class": "vsync_async",
          "bucket": 2
        },
        {
          "gate": "audio_period_deviation",
          "value": 3.644,
          "limit": 0.005,
          "class": "cadence",
          "bucket": 2
        },
        {
          "gate": "audio_fifo_level_min_pct",
          "value": 0.0,
          "limit": 15.0,
          "class": "buffers",
          "bucket": 2
        },
        {
          "gate": "av_offset_mean_ms",
          "value": -1767.52,
          "limit": 10.0,
          "class": "av_sync",
          "bucket": 2
        },
        {
          "gate": "av_offset_p95_ms",
          "value": 1913.16,
          "limit": 20.0,
          "class": "av_sync",
          "bucket": 2
        },
        {
          "gate": "av_envelope_violation_pct",
          "value": 100.0,
          "limit": 0.1,
          "class": "av_sync",
          "bucket": 2
        }
      ]
    },
    {
      "index": 3,
      "t_start_s": 180.0,
      "span_s": 6.5,
      "complete": false,
      "frame_interval_ms": 16.667,
      "av_offset_mean_ms": -1922.82,
      "av_offset_p95_ms": 1963.14,
      "av_offset_min_ms": -1968.81,
      "av_offset_max_ms": -1863.13,
      "av_envelope_violations": 390,
      "av_envelope_violation_pct": 100.0,
      "av_samples": 390,
      "present_delay_mean_ms": 5564.58,
      "present_delay_p95_ms": 5574.85,
      "present_delay_samples": 390,
      "frames_presented": 390,
      "frames_expected": 390,
      "frames_dropped": 0,
      "frames_repeated": 0,
      "frame_interval_p95_err_ms": 0.11,
      "audio_periods_written": 1300,
      "audio_periods_expected": 280,